{
  "answers": {
    "fantasy_xi": [
      {
        "record_id": "855734:31632"
      },
      {
        "record_id": "855734:290"
      },
      {
        "record_id": "855734:532"
      },
      {
        "record_id": "866681:38735"
      },
      {
        "record_id": "866681:164"
      },
      {
        "record_id": "855734:538"
      },
      {
        "record_id": "855734:226"
      },
      {
        "record_id": "866681:1459"
      },
      {
        "record_id": "855734:247"
      },
      {
        "record_id": "855734:667"
      },
      {
        "record_id": "866681:758"
      }
    ],
    "risk_play": null,
    "strategy_summary": "Balanced 4-3-3 selection using one goalkeeper, four defenders, three midfielders, and three forwards, leaning on Netherlands defensive strength and higher-upside attackers while still covering the USA vs Wales fixture."
  },
  "matchday_id": "wc-2022-20221121",
  "team_id": "not-provided",
  "team_name": "Codex Local Demo"
}
