{
  "answers": {
    "fantasy_xi": [
      {
        "record_id": "855734:31632"
      },
      {
        "record_id": "855734:152654"
      },
      {
        "record_id": "855734:38746"
      },
      {
        "record_id": "855734:532"
      },
      {
        "record_id": "855734:18861"
      },
      {
        "record_id": "855734:531"
      },
      {
        "record_id": "855734:226"
      },
      {
        "record_id": "855734:538"
      },
      {
        "record_id": "866681:415"
      },
      {
        "record_id": "855734:247"
      },
      {
        "record_id": "866681:758"
      }
    ],
    "risk_play": null,
    "strategy_summary": "Balanced 4-4-2 selection built from eligible records, leaning on a Netherlands defensive and midfield core while adding attacking upside from Gakpo and Bale plus midfield coverage from USA/Wales."
  },
  "matchday_id": "wc-2022-20221121",
  "team_id": "not-provided",
  "team_name": "Codex Local Demo"
}
