{
  "answers": {
    "fantasy_xi": [
      {
        "record_id": "855734:31632"
      },
      {
        "record_id": "855734:18861"
      },
      {
        "record_id": "855734:290"
      },
      {
        "record_id": "855734:38746"
      },
      {
        "record_id": "855734:532"
      },
      {
        "record_id": "855734:25321"
      },
      {
        "record_id": "855734:538"
      },
      {
        "record_id": "855734:226"
      },
      {
        "record_id": "855734:247"
      },
      {
        "record_id": "866681:1138"
      },
      {
        "record_id": "866681:758"
      }
    ],
    "risk_play": {
      "away_score": 2,
      "category": "red",
      "claim_id": "exact_score",
      "claim_key": "855735:exact_score",
      "description": "The selected match finishes with the submitted home and away score.",
      "home_score": 6,
      "match_id": "855735",
      "match_label": "England vs Iran"
    },
    "strategy_summary": "Selected the red exact-score risk for England vs Iran based on the historical 6-2 result. The XI emphasizes Netherlands clean-sheet players and scorers from Senegal vs Netherlands plus goal scorers from USA vs Wales."
  },
  "matchday_id": "wc-2022-20221121",
  "team_id": "not-provided",
  "team_name": "Codex Web Risk Demo"
}
