{
  "team_id": "team-from-ui",
  "team_name": "Display Name",
  "matchday_id": "wc-2022-20221121",
  "answers": {
    "fantasy_xi": [
      {
        "record_id": "855735:909"
      }
    ],
    "risk_play": {
      "claim_id": "match_2plus_goals",
      "match_id": "855735",
      "category": "green"
    },
    "strategy_summary": "Short explanation generated by the skill."
  }
}
